{
  "$schema": "https://json-schema.org/draft/2020-12/schema",
  "$id": "https://rpg.local/schema/species.schema.json",
  "title": "Espécie PHB",
  "type": "object",
  "additionalProperties": false,
  "required": [
    "id",
    "name",
    "source",
    "description",
    "creatureType",
    "size",
    "speed",
    "traits"
  ],
  "properties": {
    "id": {
      "type": "string",
      "pattern": "^[a-z][a-z0-9-]*$"
    },
    "name": { "type": "string", "minLength": 1 },
    "$schema": { "type": "string" },
    "source": { "$ref": "class.schema.json#/$defs/source" },
    "description": { "type": "string", "minLength": 20 },
    "creatureType": { "type": "string", "minLength": 1 },
    "size": { "type": "string", "minLength": 1 },
    "speed": { "type": "string", "minLength": 1 },
    "traits": {
      "type": "array",
      "minItems": 1,
      "items": {
        "type": "object",
        "additionalProperties": false,
        "required": ["name", "description"],
        "properties": {
          "name": { "type": "string", "minLength": 1 },
          "description": { "type": "string", "minLength": 1 },
          "table": {
            "type": "object",
            "additionalProperties": false,
            "required": ["title", "columns", "rows"],
            "properties": {
              "title": { "type": "string" },
              "columns": {
                "type": "array",
                "items": { "type": "string" },
                "minItems": 1
              },
              "rows": {
                "type": "array",
                "minItems": 1,
                "items": {
                  "type": "object",
                  "additionalProperties": false,
                  "required": ["id", "legacy", "level1"],
                  "properties": {
                    "id": { "type": "string", "pattern": "^[a-z][a-z0-9-]*$" },
                    "legacy": { "type": "string" },
                    "level1": { "type": "string" },
                    "level3": { "type": "string" },
                    "level5": { "type": "string" }
                  }
                }
              }
            }
          }
        }
      }
    }
  }
}
