{
  "$schema": "../../schema/species.schema.json",
  "id": "goliath",
  "name": "Golias",
  "source": {
    "book": "Livro do Jogador 2024",
    "language": "pt-BR",
    "chapter": 4,
    "chapterTitle": "Origens dos Personagens",
    "pdfPath": "doc/livro-jogador.pdf",
    "pdfPages": [
      192,
      203
    ],
    "extractedAt": "2026-06-25T23:51:33.040Z"
  },
  "description": "Os golias, que se destacam pela altura, são descendentes distantes de gigantes. Cada um deles possui as bênçãos dos antigos gigantes, manifestadas em diversos dons sobrenaturais, como o crescimento rápido e a habilidade de alcançar temporariamente a estatura de seus parentes gigantes. Os golias possuem características físicas que refletem a aparência de gigantes em suas linhagens familiares. Alguns têm o aspecto de gigantes da pedra, enquanto outros se assemelham a gigantes do fogo. Apesar de suas origens, os golias traçaram seu próprio caminho no multiverso, livres dos conflitos internos que devastaram os gigantes por séculos, e almejam alcançar alturas superiores às de seus ancestrais.",
  "creatureType": "Humanoide",
  "size": "Médio (cerca de 2,10-2,40 metros de altura)",
  "speed": "10,5 metros",
  "traits": [
    {
      "name": "Ancestralidade Gigante",
      "description": "Você é descendente de Gigantes. Escolha um dos seguintes benefícios — um benefício sobrenatural de sua ancestralidade; você pode usar o benefício escolhido um número de vezes igual ao seu Bônus de Proficiência, e você restaura todos os usos gastos quando completa um Descanso Longo: Arrepio do Gelo (Gigante do Gelo). Ao atingir um alvo com uma jogada de ataque e causar dano a ele, você também pode infligir 1d6 pontos de dano Gélido a esse alvo e reduzir o Deslocamento dele em 3 metros até o início do seu próximo turno. Queimadura de Fogo (Gigante de Fogo). Ao atingir um alvo com uma jogada de ataque e causar dano a ele, você também pode causar 1d10 pontos de dano Ígneo a esse alvo. Resistência da Pedra (Gigante da Pedra). Ao sofrer dano, pode executar uma Reação para jogar 1d12. Adicione seu modificador de Constituição ao número obtido e reduza o dano desse total. Salto da Nuvem (Gigante das Nuvens). Como uma Ação Bônus, você se teleporta magicamente até 9 metros para um espaço desocupado à sua vista. Tombo da Colina (Gigante da Colina). Ao atingir uma criatura Grande ou menor com uma jogada de ataque e causar dano a ela, você pode impor a esse alvo a condição Caído. Trovão da Tempestade (Gigante da Tempestade). Ao sofrer dano de uma criatura a até 18 metros de você, você pode executar uma Reação para causar 1d8 pontos de dano Trovejante a essa criatura."
    },
    {
      "name": "Forma Grande",
      "description": "A partir do nível 5 de personagem, você pode alterar seu tamanho para Grande como uma Ação Bônus se estiver em um espaço grande o suficiente. Essa transformação se mantém por 10 minutos ou até que você a encerrar (nenhuma ação é necessária). Pela duração, você tem Vantagem em testes de Força, e seu Deslocamento aumenta em 3 metros. Após usar este traço, você não pode utilizá-lo novamente até completar um Descanso Longo."
    },
    {
      "name": "Porte Poderoso",
      "description": "Você tem Vantagem em qualquer teste de atributo que realizar para encerrar a condição Imobilizado. Você também conta como um tamanho maior ao determinar sua capacidade de carga."
    }
  ]
}
